{
  "schema_version": "0.1.0",
  "approval_id": "approval-template-flutter-finance-lite",
  "approval_type": "template",
  "job_id": "job-bookkeeping-prepare-sample",
  "prd_id": "prd-bookkeeping-prepare-sample",
  "subject_version": "selected-template@flutter-finance-lite@v0.1.0@sha256:044bdae5cb92f850@sha256:b5c9a17f83aae97b",
  "status": "approved",
  "requested_by": {
    "actor_type": "system",
    "actor_id": "appfactory-prepare"
  },
  "decision": {
    "decision": "approved",
    "decided_by": {
      "actor_type": "system",
      "actor_id": "appfactory-prepare"
    },
    "decided_at": "2026-04-11T11:00:00Z",
    "comment": "系统为当前最小编排链路生成已批准模板快照，用于 builder-input 接线。"
  },
  "summary": "当前模板选择已冻结到本次执行快照。",
  "evidence_paths": [
    "template-fit-report.md",
    "PRD.json"
  ],
  "created_at": "2026-04-11T11:00:00Z"
}
